<?xml version="1.0" encoding="UTF-8"?>
<!--
 [y] hybris Platform

 Copyright (c) 2000-2013 hybris AG
 All rights reserved.

 This software is the confidential and proprietary information of hybris
 ("Confidential Information"). You shall not disclose such Confidential
 Information and shall use it only in accordance with the terms of the
 license agreement you entered into with hybris.


-->
<xs:schema xmlns:xs="http://www.w3.org/2001/XMLSchema" elementFormDefault="qualified">

	<xs:element name="beans" type="abstractPojos" />

	<xs:complexType name="abstractPojos">
		<xs:choice minOccurs="0" maxOccurs="unbounded">
			<xs:element name="bean" type="bean" />
			<xs:element name="enum" type="enum" />
		</xs:choice>
	</xs:complexType>

	<xs:complexType name="abstractPojo" abstract="true">
		<xs:attribute name="class" type="xs:string" use="required" />
		<xs:attribute name="template" type="xs:string" use="optional" />
	</xs:complexType>



	<xs:complexType name="bean">
		<xs:complexContent>
			<xs:extension base="abstractPojo">
				<xs:sequence>
					<xs:element name="description" type="xs:string" minOccurs="0" maxOccurs="1"/>
					<xs:element name="property" type="property" minOccurs="0" maxOccurs="unbounded" />
				</xs:sequence>
				<xs:attribute name="extends" type="xs:string" use="optional" />
			</xs:extension>
		</xs:complexContent>
	</xs:complexType>

	<xs:complexType name="property">
		<xs:sequence>
			<xs:element name="description" type="xs:string" minOccurs="0" maxOccurs="1"/>
		</xs:sequence>
		<xs:attribute name="name" type="xs:string" use="required" />
		<xs:attribute name="type" type="xs:string" use="required" />
	</xs:complexType>

	<xs:complexType name="enum">
		<xs:complexContent>
			<xs:extension base="abstractPojo">
				<xs:sequence>
					<xs:element name="description" type="xs:string" minOccurs="0" maxOccurs="1"/>
					<xs:element name="value" type="xs:string" minOccurs="1" maxOccurs="unbounded" />
				</xs:sequence>
			</xs:extension>
		</xs:complexContent>
	</xs:complexType>
	
</xs:schema>